{
    "Name": "j301_1.sm",
    "Horizon": 158,
    "Resources": [
        {
            "Key": "R 1",
            "Type": "Renewable",
            "Capacity": 12
        },
        {
            "Key": "R 2",
            "Type": "Renewable",
            "Capacity": 13
        },
        {
            "Key": "R 3",
            "Type": "Renewable",
            "Capacity": 4
        },
        {
            "Key": "R 4",
            "Type": "Renewable",
            "Capacity": 12
        }
    ],
    "Jobs": [
        {
            "Id": 1,
            "Duration": 0,
            "Resource consumption": {
                "R 1": 0,
                "R 2": 0,
                "R 3": 0,
                "R 4": 0
            },
            "Successors": [
                2,
                3,
                4
            ]
        },
        {
            "Id": 2,
            "Duration": 8,
            "Resource consumption": {
                "R 1": 4,
                "R 2": 0,
                "R 3": 0,
                "R 4": 0
            },
            "Successors": [
                6,
                11,
                15
            ]
        },
        {
            "Id": 3,
            "Duration": 4,
            "Resource consumption": {
                "R 1": 10,
                "R 2": 0,
                "R 3": 0,
                "R 4": 0
            },
            "Successors": [
                7,
                8,
                13
            ]
        },
        {
            "Id": 4,
            "Duration": 6,
            "Resource consumption": {
                "R 1": 0,
                "R 2": 0,
                "R 3": 0,
                "R 4": 3
            },
            "Successors": [
                5,
                9,
                10
            ]
        },
        {
            "Id": 5,
            "Duration": 3,
            "Resource consumption": {
                "R 1": 3,
                "R 2": 0,
                "R 3": 0,
                "R 4": 0
            },
            "Successors": [
                20
            ]
        },
        {
            "Id": 6,
            "Duration": 8,
            "Resource consumption": {
                "R 1": 0,
                "R 2": 0,
                "R 3": 0,
                "R 4": 8
            },
            "Successors": [
                30
            ]
        },
        {
            "Id": 7,
            "Duration": 5,
            "Resource consumption": {
                "R 1": 4,
                "R 2": 0,
                "R 3": 0,
                "R 4": 0
            },
            "Successors": [
                27
            ]
        },
        {
            "Id": 8,
            "Duration": 9,
            "Resource consumption": {
                "R 1": 0,
                "R 2": 1,
                "R 3": 0,
                "R 4": 0
            },
            "Successors": [
                12,
                19,
                27
            ]
        },
        {
            "Id": 9,
            "Duration": 2,
            "Resource consumption": {
                "R 1": 6,
                "R 2": 0,
                "R 3": 0,
                "R 4": 0
            },
            "Successors": [
                14
            ]
        },
        {
            "Id": 10,
            "Duration": 7,
            "Resource consumption": {
                "R 1": 0,
                "R 2": 0,
                "R 3": 0,
                "R 4": 1
            },
            "Successors": [
                16,
                25
            ]
        },
        {
            "Id": 11,
            "Duration": 9,
            "Resource consumption": {
                "R 1": 0,
                "R 2": 5,
                "R 3": 0,
                "R 4": 0
            },
            "Successors": [
                20,
                26
            ]
        },
        {
            "Id": 12,
            "Duration": 2,
            "Resource consumption": {
                "R 1": 0,
                "R 2": 7,
                "R 3": 0,
                "R 4": 0
            },
            "Successors": [
                14
            ]
        },
        {
            "Id": 13,
            "Duration": 6,
            "Resource consumption": {
                "R 1": 4,
                "R 2": 0,
                "R 3": 0,
                "R 4": 0
            },
            "Successors": [
                17,
                18
            ]
        },
        {
            "Id": 14,
            "Duration": 3,
            "Resource consumption": {
                "R 1": 0,
                "R 2": 8,
                "R 3": 0,
                "R 4": 0
            },
            "Successors": [
                17
            ]
        },
        {
            "Id": 15,
            "Duration": 9,
            "Resource consumption": {
                "R 1": 3,
                "R 2": 0,
                "R 3": 0,
                "R 4": 0
            },
            "Successors": [
                25
            ]
        },
        {
            "Id": 16,
            "Duration": 10,
            "Resource consumption": {
                "R 1": 0,
                "R 2": 0,
                "R 3": 0,
                "R 4": 5
            },
            "Successors": [
                21,
                22
            ]
        },
        {
            "Id": 17,
            "Duration": 6,
            "Resource consumption": {
                "R 1": 0,
                "R 2": 0,
                "R 3": 0,
                "R 4": 8
            },
            "Successors": [
                22
            ]
        },
        {
            "Id": 18,
            "Duration": 5,
            "Resource consumption": {
                "R 1": 0,
                "R 2": 0,
                "R 3": 0,
                "R 4": 7
            },
            "Successors": [
                20,
                22
            ]
        },
        {
            "Id": 19,
            "Duration": 3,
            "Resource consumption": {
                "R 1": 0,
                "R 2": 1,
                "R 3": 0,
                "R 4": 0
            },
            "Successors": [
                24,
                29
            ]
        },
        {
            "Id": 20,
            "Duration": 7,
            "Resource consumption": {
                "R 1": 0,
                "R 2": 10,
                "R 3": 0,
                "R 4": 0
            },
            "Successors": [
                23,
                25
            ]
        },
        {
            "Id": 21,
            "Duration": 2,
            "Resource consumption": {
                "R 1": 0,
                "R 2": 0,
                "R 3": 0,
                "R 4": 6
            },
            "Successors": [
                28
            ]
        },
        {
            "Id": 22,
            "Duration": 7,
            "Resource consumption": {
                "R 1": 2,
                "R 2": 0,
                "R 3": 0,
                "R 4": 0
            },
            "Successors": [
                23
            ]
        },
        {
            "Id": 23,
            "Duration": 2,
            "Resource consumption": {
                "R 1": 3,
                "R 2": 0,
                "R 3": 0,
                "R 4": 0
            },
            "Successors": [
                24
            ]
        },
        {
            "Id": 24,
            "Duration": 3,
            "Resource consumption": {
                "R 1": 0,
                "R 2": 9,
                "R 3": 0,
                "R 4": 0
            },
            "Successors": [
                30
            ]
        },
        {
            "Id": 25,
            "Duration": 3,
            "Resource consumption": {
                "R 1": 4,
                "R 2": 0,
                "R 3": 0,
                "R 4": 0
            },
            "Successors": [
                30
            ]
        },
        {
            "Id": 26,
            "Duration": 7,
            "Resource consumption": {
                "R 1": 0,
                "R 2": 0,
                "R 3": 4,
                "R 4": 0
            },
            "Successors": [
                31
            ]
        },
        {
            "Id": 27,
            "Duration": 8,
            "Resource consumption": {
                "R 1": 0,
                "R 2": 0,
                "R 3": 0,
                "R 4": 7
            },
            "Successors": [
                28
            ]
        },
        {
            "Id": 28,
            "Duration": 3,
            "Resource consumption": {
                "R 1": 0,
                "R 2": 8,
                "R 3": 0,
                "R 4": 0
            },
            "Successors": [
                31
            ]
        },
        {
            "Id": 29,
            "Duration": 7,
            "Resource consumption": {
                "R 1": 0,
                "R 2": 7,
                "R 3": 0,
                "R 4": 0
            },
            "Successors": [
                32
            ]
        },
        {
            "Id": 30,
            "Duration": 2,
            "Resource consumption": {
                "R 1": 0,
                "R 2": 7,
                "R 3": 0,
                "R 4": 0
            },
            "Successors": [
                32
            ]
        },
        {
            "Id": 31,
            "Duration": 2,
            "Resource consumption": {
                "R 1": 0,
                "R 2": 0,
                "R 3": 2,
                "R 4": 0
            },
            "Successors": [
                32
            ]
        },
        {
            "Id": 32,
            "Duration": 0,
            "Resource consumption": {
                "R 1": 0,
                "R 2": 0,
                "R 3": 0,
                "R 4": 0
            },
            "Successors": []
        }
    ]
}